company_id,name,category,niches,description,ideal_creator,audience,pain_point,why_sponsor,pricing_range,website,funding,region
example_co,Example Company,Developer Tools,"coding, web development, software engineering",AI-powered code completion and refactoring tool,"Coding tutorial channels, software engineering educators","Beginner to intermediate developers, CS students",Writing boilerplate code takes too much time,Dev tutorial audience actively seeks productivity tools,"$2,000-$4,500 per video",example.com,Series A ($10M),United States
zoho,Zoho,Business Suite,"business, productivity, CRM, email marketing, small business","Complete business suite - CRM, email, projects, HR, finance - 45+ apps","Small business channels, entrepreneurship content, productivity tips","Small business owners, entrepreneurs, solopreneurs, startup founders","Need multiple tools for business, expensive subscriptions, complex integrations","Huge SMB audience, proven in India/Asia, affordable alternative to US tools","$2,500-$5,000 per video",zoho.com,,India (Chennai) - Global
freshworks,Freshworks,Customer Experience,"business, customer support, CRM, sales, IT service","Customer service, CRM, and ITSM software - Freshdesk, Freshsales, Freshservice","Business channels, SaaS tutorials, customer service training, startup content","Small to mid-size businesses, support teams, sales teams, IT teams","Poor customer support tools, expensive enterprise software, complex setup","Fast-growing market, competes with Zendesk, strong Indian connection","$3,000-$6,000 per video",freshworks.com,,India (Chennai) - Global
razorpay,Razorpay,Payment Gateway,"fintech, e-commerce, business, entrepreneurship, online business","Payment gateway, banking, lending - complete financial stack for online businesses","E-commerce tutorials, online business channels, fintech content, startup advice","Online business owners, e-commerce sellers, SaaS founders, Indian entrepreneurs","Complex payment integration, high fees, limited banking features, paperwork","HUGE Indian e-commerce market, every online business needs payments","$2,000-$4,500 per video",razorpay.com,,India (Bangalore)
postman,Postman,API Development,"coding, API development, backend, software engineering, DevOps","API platform for building, testing, and documenting APIs","Backend development channels, API tutorials, software engineering education","Backend developers, API developers, software engineers, DevOps engineers","API testing is manual, documentation is outdated, team collaboration on APIs","Industry standard tool, developer audience, Indian unicorn success story","$3,500-$7,000 per video",postman.com,,India (Bangalore) - Global
clevertap,CleverTap,Mobile Marketing,"mobile apps, marketing, user engagement, retention, analytics","Mobile marketing platform for user engagement, retention, and analytics","Mobile app development channels, growth marketing content, app monetization","Mobile app developers, growth marketers, product managers, app founders","User retention is hard, push notifications poorly targeted, fragmented analytics","Mobile-first market in India/Asia, every app needs retention tools","$2,500-$5,000 per video",clevertap.com,,India (Mumbai)
chargebee,Chargebee,Subscription Management,"SaaS, subscriptions, billing, revenue, business",Subscription billing and revenue management for SaaS and subscription businesses,"SaaS tutorial channels, subscription business content, entrepreneurship","SaaS founders, subscription business owners, finance teams, growth teams","Subscription billing is complex, revenue recognition, failed payments, dunning","SaaS boom in India, every subscription business needs this","$2,500-$5,000 per video",chargebee.com,,India (Chennai) - Global
